courseid,chapterid,sectionid,unitid,subunitid,-,topic,-,chapter,-,Cognitive level,-,description_of_topic,-
5,9,10,,,,Scope rules,,Program Representation,,Understand,,static vs. dynamic; visibility of variables; side-effects,
5,9,11,,,,Environment vs. store and their properties,,Program Representation,,Understand,,,
5,9,12,,,,Data and control abstraction,,Program Representation,,Understand,,,
5,9,13,,,,Mechanisms for information exchange between program units,,Program Representation,,Understand,,"nonlocal variables, global variables, parameter passing, import-export between modules",
5,9,14,,,,Types of parameter passing with simple illustrations and comparison,,Program Representation,,Understand,,"call by value, call by reference, call by value-result, call by name, call by need and their variations",
5,9,15,,,,"Side-effects induced by nonlocal variables, global variables and aliased variables",,Program Representation,,Understand,,,
5,9,16,,,,"Data structures trepresent code for execution, translation, or transmission",,Program Representation,,Understand,,,
5,9,17,,,,Low level instruction representation,,Program Representation,,Understand,,"such as virtual machine instructions, assembly language, and binary representation",
5,9,18,,,,"Lambda calculus, variable binding, and variable renaming.",,Program Representation,,Understand,,,
5,9,19,,,,String-based mobility in mobile coding.,,Program Representation,,Understand,,,